{
  "v": 1,
  "type": "hello",
  "id": "550e8400-e29b-41d4-a716-446655440000",
  "seq": 0,
  "ts_ms": 1694703600000,
  "from": "headset",
  "payload": {
    "device_id": "headset-001",
    "role": "headset",
    "versions": {
      "sdk": "0.1.0",
      "shell": "0.0.1"
    },
    "games": [
      {
        "id": "orchard_reach",
        "version": "0.1.0"
      }
    ]
  }
}
