{
  "v": 1,
  "type": "status",
  "id": "550e8400-e29b-41d4-a716-4466554400aa",
  "seq": 4,
  "ts_ms": 1791367200000,
  "from": "headset",
  "payload": {
    "state": "running",
    "game_id": "phantom_hand",
    "fps": 72,
    "elapsed_s": 96.5,
    "game_state": {
      "phase": "induction",
      "condition": "sync",
      "remaining_s": 41.5,
      "nodes": {
        "haptic": {
          "connected": true
        },
        "bio": {
          "connected": true,
          "emg_level": 0.07
        }
      }
    },
    "trace": {
      "emg_env": [
        412.5,
        415.1,
        418.9,
        421.3,
        419.0
      ],
      "accel_mag": [
        9.8,
        9.79,
        9.81,
        9.8,
        9.82
      ],
      "t0_ms": 96400,
      "fs_hz": 20
    }
  }
}
